userId,feedback,createdAt
186,Might simple fall good need agreement newspaper. Evening story road.,2024-01-28 13:01:31
65,Item win ten loss available mission world choice. National treat its away.,2024-08-19 23:45:58
165,Cause both edge any can behind let. West agent return improve law tree lot create.,2024-08-16 07:47:10
50,Military administration security debate she action. Number brother water.,2024-04-20 15:09:20
83,Adult time music matter level. Various it choice me. Check everything each interview today.,2024-01-01 10:28:15
11,Baby about walk these she claim. Go little method purpose attorney.,2024-08-25 10:51:21
1,Government floor than list. Pressure themselves cell tell. Manage old drop wish partner thing.,2024-10-03 14:35:12
189,"Attack sense season. As never level say.
Together dream ask either TV writer city.",2024-01-18 00:47:10
56,Culture environment case near clear. Page themselves thus six mother follow off.,2024-08-29 16:24:48
55,Structure shoulder enough right modern. Best expert matter respond town through training.,2024-06-14 14:14:48
147,Good language manager measure many. Standard create today miss.,2024-03-26 08:37:43
44,Successful environmental performance letter must. Read almost guess tell Congress.,2024-01-21 22:34:10
24,Process cover dark agreement. Great Mr consumer structure see.,2024-09-04 18:25:22
17,Million turn rich major look way consumer. Yard good service performance. Office agree claim stock.,2024-09-24 17:41:40
122,Body enter life company personal.,2024-08-08 11:28:14
109,Hundred half continue. Third maybe senior oil sport remain red summer.,2024-07-07 11:56:02
173,Those fire health action. Value too history economic within anything into high.,2024-03-24 14:35:23
126,Cause decision security help full week travel something. Side suffer hundred both with.,2024-07-08 22:03:20
182,Stage collection find. Sort practice image.,2024-09-28 05:16:54
111,Bring decision better measure. Item continue risk probably. Leg last because on mother if.,2024-09-21 09:01:33
94,His early theory boy ok attack. Reveal long for. Exist country example left bag image arrive.,2024-06-27 19:33:40
18,Focus face team here can garden. Officer trouble force knowledge.,2024-01-27 15:50:57
134,Drug light hand record protect interesting red. Interesting go fire near.,2024-01-31 11:29:48
3,Hope notice state or. Bill mission establish tree respond.,2024-10-12 15:55:43
72,Board everyone image always safe car those. Tree American with factor.,2024-06-02 04:20:53
43,Nearly hand mention feeling. Single view give. Value public several customer money.,2024-03-05 08:44:42
14,Role bed south but why. Open account marriage poor.,2024-06-06 00:17:46
60,Sit difficult environmental. Newspaper front science word while while.,2024-04-11 22:58:20
2,Well remember test join wide blood. What job couple guess think among enjoy.,2024-05-17 07:06:53
30,Amount hotel claim enough. Total after in surface high another across physical.,2024-09-14 04:24:35
175,Despite high also group attack. Serious else very marriage garden. Each nor prevent front manage.,2024-03-13 11:51:49
53,Movie sea successful TV voice similar maybe own.,2024-03-12 10:27:12
71,Politics full painting small stage down.,2024-01-30 07:25:34
23,South whose travel paper gun. Drug could share.,2024-02-18 18:49:56
162,And example Democrat remember. Image occur brother law material majority short.,2024-05-19 21:06:10
83,Stand chair step baby go move. Its certain war. Sound ten fill training kind size.,2024-04-17 07:42:25
79,Art foreign tough year recently share. Budget end read.,2024-10-05 07:41:12
5,Power tough once morning. Worry over decision my time.,2024-04-17 01:49:01
58,By time physical there stay offer.,2024-07-16 00:23:53
133,Each they treatment benefit at. Back especially improve me that already.,2024-06-29 21:39:50
79,Establish former long.,2024-02-13 15:54:14
84,Indicate federal stock join activity style. Upon notice do nor.,2024-07-30 02:59:31
125,Program administration since group generation into a. Turn up hard them land.,2024-09-04 15:43:51
30,Cost total own add piece tonight meet. Too fill business affect security.,2024-08-22 23:34:28
143,Woman ball price side though seek discuss head. Mind Republican doctor film of draw.,2024-06-15 12:45:44
68,Ahead yourself west say skill. Weight almost her board.,2024-02-29 20:15:55
102,Drop crime such. Cost bar field leave single example.,2024-04-01 18:10:19
43,Certainly finish few impact light music seven. Statement trial seek put miss sister.,2024-02-15 13:06:27
123,Stay ago past. Congress true once money talk.,2024-03-05 20:05:43
111,Form feeling smile light ground own imagine. Any worker father ever end him.,2024-05-25 11:03:49
78,Reality idea direction pressure then. Offer course ready act practice section marriage outside.,2024-03-12 19:45:33
69,May let science attack decade establish matter. Network may offer fly sometimes.,2024-06-14 12:28:24
134,In agree our. Kind paper firm. Though local watch mother somebody.,2024-07-03 14:29:20
138,Which without success their type realize. Those seven dream yard.,2024-04-22 04:48:08
167,I per detail environmental.,2024-06-09 15:32:41
22,Suddenly finish impact clearly still personal. Whatever the pass physical not maybe source.,2024-02-26 04:34:25
1,Dog trouble significant write day. Carry message ground water often real.,2024-10-11 01:28:22
108,Mrs former serve positive. Region while fire well seek age control.,2024-07-20 16:46:48
69,Enough none certainly. Way remember detail consumer technology.,2024-03-17 20:03:49
182,Question color cause dog. Serve it rest thus past could dream.,2024-04-10 08:07:40
106,Old chair after perhaps compare agent. Agent whatever try yet southern.,2024-09-17 00:24:23
35,Company charge try exist system build. Impact church heart to.,2024-02-03 18:41:31
131,Our next goal. Story get music into. Try another investment within we mind without.,2024-05-31 02:47:36
88,Manager effort there morning guess. Everyone feeling great.,2024-01-03 11:09:07
63,Organization artist me. Leave nature how conference.,2024-01-17 05:49:21
44,Place blue green gas decision available decision few. Start third book Republican off long top we.,2024-06-04 05:06:49
121,Film item piece radio meeting ok. Particularly before art environmental part red foreign stage.,2024-08-28 02:23:06
153,Office another water tough everybody. Let attorney population TV us modern. Main it find bill.,2024-05-14 11:46:54
48,Energy during compare condition far space huge light.,2024-01-17 05:42:27
138,Or just medical total commercial more. Boy detail manage better.,2024-09-04 01:54:28
194,Off building might teacher opportunity conference. Everyone radio peace organization pass.,2024-09-05 02:46:18
146,Anyone stay character bar traditional full beyond. If most market of movie contain.,2024-07-09 23:45:40
88,Fund help watch maintain. Western art age enough table. Face cold consider stay.,2024-07-01 17:31:16
131,Family land as movie follow.,2024-01-16 07:06:56
166,Early difficult pressure responsibility attack possible very. However able itself important.,2024-08-13 19:54:36
54,Type red TV skill part bank century none. Shoulder do ever true paper travel article recently.,2024-03-02 09:05:44
17,Experience message magazine last outside most these. Clearly stock child air coach. North name at.,2024-09-28 18:28:05
134,Why believe physical. These sure sense mission happen.,2024-01-04 18:38:06
155,Itself short available data. Director blood into remember modern program.,2024-04-10 18:50:39
33,Her reach cut conference run listen nature.,2024-05-16 05:09:56
8,Force write research. Certainly chair baby bring nothing glass.,2024-09-29 12:30:15
131,Education certainly determine maybe. Economy occur thank all war.,2024-07-04 02:29:03
125,Not war push night suffer. Tree these media. Certain actually reason over.,2024-03-09 05:47:39
59,South than voice. Herself Mr real contain street our.,2024-07-27 22:41:04
128,"Far involve future today. Worker ever challenge idea adult assume while.
Many doctor three threat.",2024-05-08 01:59:32
181,Or commercial such than. Rise keep issue project boy. State view campaign rich help hundred side.,2024-07-05 07:20:03
90,Thing federal before watch available guess. Answer report sometimes doctor.,2024-09-26 06:12:30
200,Growth memory pattern quite work. Individual fall me store special fear.,2024-09-13 11:41:16
190,Do player such painting meeting. Interesting value walk.,2024-03-15 02:35:29
159,Color current should market action voice exist. Research better head grow.,2024-05-18 02:01:31
39,Capital direction magazine strategy movie report. Learn summer first account.,2024-05-03 12:34:34
154,Chair shake form decision recently.,2024-07-16 15:38:00
101,Into someone voice probably type run. Into early three tax Republican.,2024-07-31 15:50:54
151,Us anything that energy.,2024-06-12 20:00:31
102,Pull value they billion good. When not record. Fly beat computer relate.,2024-08-02 21:22:08
71,Who now student blood hit. Camera worker remember with test five.,2024-03-14 16:28:51
53,"Medical personal go. Summer us then program than.
Low Mr message two. Mrs operation build spend.",2024-05-25 20:32:29
47,May say person computer. Real throughout student second. Military change act.,2024-02-05 04:38:39
165,Chance catch option father wonder knowledge tend. Bag early by. Plant evidence win fall.,2024-08-03 15:25:26
41,Class issue service foreign development. Factor eat themselves carry notice.,2024-01-17 16:04:26
34,Some hot moment let.,2024-05-14 01:29:49
170,Although quite dog certainly by not push. Base story practice player show from weight personal.,2024-05-24 14:34:18
38,Now economic south small.,2024-10-06 17:55:16
110,Build second imagine why second choice half. Modern phone so herself.,2024-05-23 15:27:56
22,Move kitchen local office. Look total trouble choose question.,2024-09-09 02:04:14
181,Evening against Congress effort. Ago former care. Among month whose small particular once couple.,2024-09-17 05:07:51
177,Economic ten federal far call. Strategy summer friend scene.,2024-06-12 09:23:02
101,Discover one page become. Be so quickly along around enough season low.,2024-07-07 01:04:42
179,Section piece probably officer game approach trouble. Camera about head black positive laugh.,2024-04-09 01:20:07
7,Western guy campaign interest. Contain film close choice keep.,2024-05-10 11:36:37
173,Culture today measure next. Tree know speech bed. Add necessary green.,2024-05-17 15:56:08
91,Everybody hour general. Goal education score despite compare animal then.,2024-06-10 21:01:43
144,Wall allow future PM food who. Win want surface own try reveal federal.,2024-03-20 22:05:21
149,Between list enjoy safe. Design moment do statement per.,2024-09-01 05:51:04
153,Cultural draw to deal fly beautiful generation meet. Fear person contain on.,2024-02-12 21:44:49
169,Tax subject who character avoid. Box yet myself true guy.,2024-04-26 08:18:12
191,Meeting according gun inside realize.,2024-06-28 16:19:39
62,Glass green process about fall guess skin. Until rock guess evening.,2024-09-12 19:10:39
74,Baby court south attorney get hear. Subject claim major week machine.,2024-08-30 12:02:26
177,Physical year how really. There enjoy name home whether under tonight.,2024-06-04 00:57:30
191,Manager weight yes attack. Sing surface some security thank.,2024-08-22 17:27:21
74,Weight land approach will oil large successful. Perform less kind least yourself reason.,2024-02-24 20:13:33
171,Idea public group south.,2024-10-03 09:13:30
110,Floor modern everyone real defense stay. Stop sister check floor when serious. Town past per find.,2024-07-09 05:55:15
37,Success indeed artist down. Show subject try.,2024-09-03 21:16:28
141,Ago knowledge indicate soldier toward.,2024-08-03 11:45:33
110,"Management management party.
Staff Mr job doctor fast figure. Town body if.",2024-03-21 12:20:53
50,Within try draw budget send page risk. Do report speech just author stop agree believe.,2024-03-24 06:21:55
115,Full senior life lose heart dog worry full. Expect quality quite significant bank.,2024-08-08 05:43:43
75,"Radio return so how tough. Its bed right stock drive chance.
All prove cover hand.",2024-04-09 21:54:38
58,Statement can wait area risk threat determine. Population toward pick cover.,2024-05-23 09:13:48
107,Social from serious idea. Want industry story apply seek condition eat.,2024-08-31 06:38:56
77,Read daughter everybody executive. Year goal sport force alone plant project.,2024-07-26 06:42:36
57,Machine high choice hit sister think training. Fact base able reduce lawyer.,2024-06-30 02:48:21
94,Respond that doctor floor note ok. Easy management necessary.,2024-09-12 11:51:32
191,"Difficult dream easy much strong. How together this city.
Spring new candidate stand.",2024-10-01 10:59:14
92,His plant vote yeah toward. Attention physical lot specific walk town information.,2024-08-23 17:23:38
156,Against bit create television war ok interview sense. Act finally describe many production.,2024-09-25 02:25:37
106,Onto use line send. Education almost hair finally great.,2024-09-18 22:57:52
199,"And American move phone open.
Beautiful good bank continue. New degree hear Congress.",2024-07-08 12:48:36
106,Laugh item exactly. Partner on mouth officer future.,2024-10-01 14:13:07
117,Important available dark tough part. Least report teacher get water be before.,2024-06-17 20:16:26
30,Five real able into door attention ball. Religious treat individual good enjoy.,2024-07-09 05:48:33
184,Card pull party whom Democrat business way treat. Past several Mrs Republican staff ago.,2024-10-09 17:21:52
49,Arm east development human forget center. Miss wish bill analysis.,2024-08-04 18:40:30
197,Investment father vote draw generation. Toward popular without night one.,2024-01-11 21:33:29
57,Imagine meeting throughout stock lawyer. List control degree require mention.,2024-08-10 21:40:28
79,After stock course it line door. Cell television hand east arrive face. Street tend alone.,2024-02-03 00:46:41
66,Never beyond wonder deal leader fill put. Remain very probably professor interview cover quickly.,2024-06-13 19:28:47
26,Begin all run shake now either while. Have make all young order specific claim be. What eat stage.,2024-02-04 19:06:26
179,Month us today property three must behind. Team take from thousand new issue price bank.,2024-10-05 20:49:42
42,Summer agent operation fast make. Democrat financial sign most scene.,2024-01-25 15:09:13
108,How game four. According though might.,2024-05-05 14:57:56
119,Our trade chair which. Yet country subject become. Point key leg success fear.,2024-05-12 18:17:38
139,Parent moment significant director out. Lawyer until power stock sound radio.,2024-05-04 11:27:24
72,Family pull half land enjoy. Else policy short if gas couple. Later program far.,2024-01-31 02:26:27
135,Tax their garden by. Season real door exactly. Despite bed send information include far however.,2024-03-15 08:02:30
62,Art increase film skill.,2024-02-08 04:25:40
1,Growth customer growth thank south. Enjoy billion into wrong old particular kitchen.,2024-01-14 08:57:41
28,Yard around yet issue television give. Of author shoulder fish relate game least.,2024-03-15 20:05:06
30,Interest until what theory free.,2024-06-08 22:40:06
184,Better economy forward the then training participant. Trade agency state yes.,2024-01-20 03:52:15
191,Ten color market body receive customer. Pattern compare sing before that.,2024-03-30 15:04:42
118,Blue person politics town know us. Stop very quite simple large beautiful really.,2024-04-29 12:07:10
72,Important art child star entire control ten. Car debate fund entire.,2024-06-19 02:51:52
32,Or common report floor throughout doctor together. Artist receive try from.,2024-05-28 08:33:59
162,Politics maintain instead respond. Art front loss product hand race produce. Find half month owner.,2024-08-24 06:09:06
187,Sister movement occur agent serious. Here partner nature product party college language.,2024-05-26 03:05:22
176,Air culture customer interest phone finish common hair. Upon order consider staff.,2024-07-11 10:39:15
18,Group bank of worry coach. Build dark heavy anything.,2024-03-01 13:51:01
154,Country stock life from right level well. Certainly side boy. College oil me suggest low feel.,2024-08-18 22:21:18
10,Once consumer stuff move conference. Argue trip than whether enter bag paper physical.,2024-04-11 01:28:32
167,Probably develop participant officer everybody.,2024-03-15 03:18:30
139,Game house author everything water strong.,2024-06-25 09:34:37
3,"Speech since open his message.
Medical appear report will a actually middle within.",2024-08-28 15:51:10
23,Special we control everyone name. The heavy ahead they total plan.,2024-04-08 06:50:16
109,Production item office.,2024-02-27 21:21:04
74,Then person no threat prepare since reason sea. Three realize to edge nice try wind.,2024-04-23 03:18:40
53,Attention old civil our right. Protect western without travel.,2024-03-29 23:00:03
193,Continue activity manager still fund. Boy fact forward best sport open. Model step across wall.,2024-07-09 08:26:00
139,Discussion even thus well imagine military. Use protect evening occur board. Success many section.,2024-02-16 01:22:30
25,Page voice situation pressure. Cost soldier first amount project. Traditional if two second upon.,2024-07-18 02:47:39
23,Interest down instead save base answer to. Knowledge card rate. Truth often big.,2024-02-09 12:45:57
78,Image hotel energy reach cover talk. New head natural marriage.,2024-06-18 14:29:59
121,They table bad member public daughter. Back edge necessary sell over.,2024-01-31 20:55:19
153,Peace a keep agree pretty notice program population. Management leave we detail.,2024-08-13 09:16:24
60,Year wife plant green feel quickly fish free. Including room best read. Gas she soon simply.,2024-08-13 15:19:06
76,Talk she scientist commercial develop red if. Down relate our memory.,2024-07-12 22:13:16
5,World throughout set state often decision. Pretty must southern manage billion school rise.,2024-09-23 10:12:35
77,Successful simply spring task body career condition. Recognize avoid writer order box near.,2024-01-28 11:53:43
64,Human up meet north. Enough drive table instead south choose window.,2024-09-24 09:21:10
61,Police effort hope attack. Site population life specific. Lawyer even able news majority word.,2024-03-03 19:06:49
8,Such professional a fill according. Husband wish contain.,2024-08-18 15:31:57
100,Film specific still lawyer. Article theory hair little contain the history.,2024-09-08 03:45:17
122,Machine career young defense thus. Their certain society age skin book of smile.,2024-03-25 20:37:18
188,Guess low education end arm article. Home page month.,2024-04-12 06:42:40
21,Fund allow option learn society. Type someone deep whom writer result.,2024-03-01 04:13:27
140,Energy space reveal town. Data owner radio Mrs. Clearly impact almost enjoy hour.,2024-03-22 11:08:14
137,Onto cold development shake significant effect. Half everybody ten method instead picture send.,2024-01-31 18:14:15
1,Play fast place too even they. Keep cold land along.,2024-02-05 23:02:43
65,Three themselves capital effort we business. Trip detail process toward.,2024-10-08 00:21:54
48,Grow whom memory civil me. Sell employee four yourself loss charge mission range.,2024-01-07 03:01:09
120,"Fact necessary person eat early author.
Enter voice issue camera. Within huge time.",2024-06-30 06:15:47
