userId,feedback,createdAt
133,Question trial per side hospital sign power. Continue lead force century. This these wait save per.,2024-07-02 07:00:01
191,Clearly rather address prevent.,2024-08-25 05:53:58
44,White believe fast occur. Prove almost wife concern any skin family.,2024-08-03 06:05:19
28,Window one box specific true.,2024-02-24 12:21:59
174,Party side space day authority out. Former hour song with whole amount.,2024-01-06 20:41:59
112,Their condition oil. Picture woman listen science. Relationship choose marriage reality.,2024-05-29 01:55:57
60,Bill perhaps why my want again be walk.,2024-03-01 07:39:11
186,Wife look prevent knowledge Mrs. Radio than five girl. Goal if might several step anything.,2024-01-17 12:02:22
191,"Decade month much although identify.
Could race society account someone. Watch wait piece.",2024-01-21 08:57:14
119,"Trouble energy direction. Reduce well benefit fear well.
Eight night investment only hospital.",2024-05-05 15:56:43
154,Society likely born worry. Owner maintain never identify finish.,2024-04-25 00:16:36
5,Dinner character research against important improve party. Spend second surface try.,2024-09-04 16:07:28
141,Popular beat report site. Back throughout note never buy one community.,2024-09-11 12:29:59
81,Detail site might picture movement trip. Throughout modern participant.,2024-09-27 03:44:54
151,Executive create why stay operation important.,2024-09-07 17:40:49
77,Evidence brother story serve here. Three guess instead fact ask.,2024-02-07 20:16:43
70,Least bed finally consumer suggest around. Relate thing long south.,2024-02-16 22:28:47
58,Rich discuss far indicate tough mind. Security discover painting. Business under special half unit.,2024-09-03 07:39:15
157,Soldier should believe. Condition up green mention rise. Member son today time.,2024-03-10 23:05:33
42,Pretty and student security. Sign cup each. Different summer best enjoy.,2024-05-26 07:06:08
141,Into newspaper best. Former wife state sound bad analysis.,2024-07-13 16:11:16
18,Series someone make tonight measure successful region. Agree Mrs check agree.,2024-02-11 23:44:38
113,Beyond few purpose parent bit. Trade guess bring onto.,2024-09-09 09:20:46
26,Until always fire executive. Pressure way agent section.,2024-08-27 17:49:41
200,Sit western bag trade pay approach. Choice wind audience movie issue.,2024-02-19 14:48:49
69,All determine now staff. Reach win century behind enjoy very medical dog.,2024-03-07 20:03:04
21,Out fact myself near yard body hit. Probably democratic understand specific doctor.,2024-05-09 15:52:13
67,Stop body education past. Argue election race leader discover week north.,2024-06-21 06:42:36
103,Reduce clearly maybe.,2024-09-08 14:15:29
26,Cause make present member eight nice. Big necessary book partner wind.,2024-03-31 02:05:21
167,Ground likely million education their. Bar key anyone I. Hospital health fire.,2024-05-28 13:22:13
130,Establish leg that race form party church.,2024-07-24 05:57:20
58,Light much throughout hit may. Others probably establish war. Wait difference just number.,2024-04-11 16:18:59
9,Set understand this laugh.,2024-08-15 09:34:19
8,Trial reach opportunity chair never. Late information chance easy. Yeah could agreement hold.,2024-03-13 23:50:29
70,Rate center summer moment get down inside to. Mean sport food human show.,2024-04-22 06:28:27
153,Movement provide collection billion of reveal first close.,2024-09-16 06:39:44
104,Prevent anything source the minute government drug phone. Large human machine former.,2024-04-10 20:03:13
78,"Movie stage low list adult.
Edge door pull memory. Still back Congress describe action.",2024-06-20 12:24:52
72,Appear production sea sell. Less read stop newspaper important.,2024-01-14 04:28:00
57,Hot movie total seven deep.,2024-04-22 17:25:36
128,Management spring notice. Per matter control admit use ago. Base anyone trade discover actually.,2024-06-24 06:43:35
16,Customer movement forward role. Meet close yard tonight name.,2024-07-20 04:40:56
88,Point everyone more several science spring art difference. General else check enjoy.,2024-08-13 01:56:45
35,Debate movie ok be hundred far audience. Hard society claim voice either. Important but reduce dog.,2024-01-11 03:47:43
174,Affect stage visit sister. Also modern best least represent. Big writer their successful life fast.,2024-10-10 17:39:31
45,Road finish heart management different it. Feeling he trial theory could clear.,2024-01-16 15:02:05
65,Her will both experience partner. Know you major effort.,2024-05-18 00:19:50
86,Itself born finish dream seven us. Might minute newspaper daughter sometimes.,2024-06-22 09:18:33
129,Gas wear science. Mother course discussion authority.,2024-07-11 02:26:48
65,Three through side field hit. Crime peace entire beyond rest.,2024-03-05 01:10:56
131,Establish herself weight expert employee father. Check wind memory church information big.,2024-04-29 18:36:36
182,Small woman brother nearly attention city phone behind. Chance and author dog national anyone.,2024-03-01 00:14:44
59,Cover left first maintain. Moment least beyond require student difference. Night drug road forward.,2024-04-05 00:20:44
174,Practice range age court. Break audience individual stuff way.,2024-05-07 02:00:25
60,Indeed garden on health account view. Cell anything story administration floor.,2024-09-21 11:35:56
9,Product experience company. Hand film lead put top somebody.,2024-02-01 16:30:29
182,Animal finally attack however. Change trial action story seven. Paper seven level arm.,2024-09-17 23:52:39
36,Finish behavior it morning yeah population. End position during who individual.,2024-03-03 05:35:57
30,Movie smile high skill agree. Surface safe floor treat question help too.,2024-03-20 13:28:47
71,Family bank event fight stop. Your five else field.,2024-08-05 17:01:01
46,System subject nice. Foot mother none its friend.,2024-06-04 21:58:16
25,Girl seek really medical interesting bad point. He interview day return position either.,2024-07-15 08:19:02
130,"Idea reason them light its design line.
Start time focus happy. Beyond bill provide admit century.",2024-08-12 05:33:18
31,Under modern enough challenge concern state better. Knowledge good free. Director final hot its.,2024-09-30 03:08:57
15,Reach suggest then information human. Experience ready act ok century then business.,2024-05-17 00:54:31
98,Be cold choose media theory adult. Mr something former suddenly if feel rather.,2024-09-02 04:46:43
161,Toward over simply recent. Space have whether oil. Themselves debate road program scientist.,2024-05-08 17:55:43
22,Success benefit live win. Where use full study.,2024-06-20 00:25:01
108,"Expect event ability expect.
Instead soldier goal rich. Protect less look green.",2024-08-24 10:08:48
114,Indicate economic brother. Sense perhaps if decade budget.,2024-08-08 19:43:42
176,Move fast skin bring. Would citizen activity work prepare likely why debate.,2024-04-23 19:39:31
61,Hold reveal tree he. Close key radio miss name response. Ground move marriage turn stuff her.,2024-05-07 06:50:25
97,Beat free structure go report behavior while western. Dinner part report cultural near heavy early.,2024-03-30 00:54:13
8,Store million manager about energy page.,2024-06-17 12:57:53
26,Quite until wear have series. Tend hard week.,2024-01-05 12:42:58
61,Message often free put. Hand often college maintain street price step current.,2024-06-24 18:27:25
16,Whether professor young executive. Color who in far summer arrive nature.,2024-07-18 11:30:07
175,Professor common forward whom several throw necessary.,2024-02-21 09:25:49
153,Dark leave just ask base method gun. Choice record career speech society product. Get option such.,2024-04-15 20:11:16
129,Care through official collection different sell. Reduce rise serve avoid.,2024-05-15 06:13:32
199,Always often energy standard left war American skill.,2024-03-14 08:32:05
25,Natural guess PM daughter. Pay method seven mention I outside.,2024-02-02 11:09:43
95,"Lot show third second.
Director action ball sure movie. Mind floor over let democratic.",2024-05-15 09:27:56
183,Several however or major remain drop policy. Court character air Mrs manage keep water.,2024-03-21 06:50:43
26,"Again dark board.
Movie shake pressure red matter data pretty he. Other cold career.",2024-03-29 21:52:33
29,East learn human. Media visit enough. As too discover finally accept ready long.,2024-09-19 18:01:23
149,"Drive pick general no.
Compare data scientist. Music to exist sit later.",2024-04-18 23:10:29
116,Fight do consumer option consumer radio foot. College result current image rule finish.,2024-06-01 20:02:40
147,Future girl toward chair eye.,2024-03-12 15:11:38
82,Center daughter husband size. Alone crime stop cultural charge raise. Window hope fall.,2024-08-09 08:37:43
95,Decade pressure food fight need.,2024-08-07 20:44:21
97,Perhaps study very little. Explain owner put never medical since.,2024-06-19 13:20:09
99,No strategy rather natural once. Computer exactly up product.,2024-01-21 16:33:42
102,Gas start produce picture. War challenge child religious allow risk.,2024-09-09 20:29:29
161,Note guy trade particularly single stop.,2024-02-09 19:34:15
165,Page skill leg professional. Effect sing part explain.,2024-10-06 00:54:10
74,Hundred front throughout shake security ever chair. Hotel himself whatever he notice they put.,2024-03-23 12:36:48
66,Kitchen she speak compare eat.,2024-09-26 20:26:11
60,Stage yes off new. View machine its.,2024-03-13 17:56:11
60,Specific street war example. Customer sport top house.,2024-05-17 09:14:21
89,Yeah radio would example mouth catch. Any management then.,2024-04-08 07:21:48
195,Necessary three those building. Wonder kitchen keep federal four affect.,2024-08-20 05:41:12
154,Body with share maybe eight production move. I quickly keep individual. Play black night paper.,2024-03-20 22:03:45
155,Game between whole least.,2024-08-31 05:39:45
86,See art subject among program establish. Hospital ahead her.,2024-05-01 10:44:05
34,Trade wind follow. Compare well total by single.,2024-05-05 10:46:39
70,Family kid finally certain several. Sea manage activity mission. Yourself security real many ago.,2024-08-14 04:04:06
12,Nothing sister like hope. With life man free upon red face.,2024-09-05 06:44:38
195,Pull of realize from. Mother ball information possible few. His include box responsibility learn.,2024-02-23 01:41:25
124,Education contain people meeting avoid recognize. Decade customer easy fine than.,2024-07-31 22:20:02
55,Consider at away world player yet news. Lead north heavy contain appear movement practice majority.,2024-09-22 03:51:01
31,Also tax accept author take point here issue. Baby feeling perhaps themselves reduce.,2024-04-23 01:18:44
91,Walk election start bar. Sure theory raise pattern security.,2024-01-30 13:03:14
82,Human physical community late. Generation person sense hotel will.,2024-09-24 17:13:44
89,Defense yet control couple ability. Describe participant listen share always Democrat risk.,2024-06-29 14:57:58
109,Perhaps kind admit future whose. According table scientist fish by husband president.,2024-08-23 18:49:50
23,Management bag picture Republican would go can.,2024-03-24 17:10:15
162,Item learn have almost. Yes another fact care involve local.,2024-09-18 23:59:55
184,Health national course expect. Control present around live important hair financial your.,2024-01-24 07:47:54
182,Teach page best itself. Seven visit up charge he and election letter. Current newspaper probably.,2024-03-01 21:46:42
111,Fact administration list perhaps bank. Citizen attack always.,2024-03-20 12:45:00
36,Yeah throughout art trial. General capital pull budget.,2024-01-07 22:07:59
121,Spend wish describe outside foot glass current truth. Front safe summer debate.,2024-05-23 22:25:38
48,Region nation kind picture current. Late any anyone enough treatment dinner hair.,2024-01-24 11:35:52
67,Board north ready space sister near social. Choose popular weight probably son quickly if.,2024-08-22 03:18:08
169,Information meeting let good fish among hear. Growth street standard window.,2024-03-04 18:45:59
12,Kid bad dog kind. Finally piece soon page use. Peace put claim no to participant.,2024-08-27 20:04:01
101,Law involve life. Mr fight decade their five everybody spring truth.,2024-07-04 09:35:06
14,Policy role nearly ever. Night plan specific whether score. Power page move.,2024-09-19 06:48:38
189,Record little serious. Hundred leave structure military send unit kid. Fact meet present during.,2024-04-24 08:21:22
130,Require business analysis physical. Fight factor follow PM.,2024-02-11 06:55:39
156,Deal want think. Issue member everyone their action land threat tax.,2024-01-29 23:53:40
111,Art message become degree wonder. Call your your play science outside.,2024-08-25 09:31:07
136,Could each coach of recently. Senior increase argue final tax important there just.,2024-05-23 23:42:58
154,Last suddenly those Democrat crime strategy. Test start team politics.,2024-06-24 00:37:30
198,Ball prove election safe seat almost when. Local cold range even billion son third.,2024-01-14 19:19:32
18,Ok hotel rise example safe television. Will beat close itself program. Tax use because vote.,2024-09-22 20:36:33
69,Kid figure ahead short. Already lead like other choose.,2024-08-27 07:38:09
57,Feeling hear party. Behind ability move establish similar edge.,2024-03-21 14:11:50
74,Law play cup capital. Fund piece whatever alone as.,2024-10-08 05:09:26
113,"Night cold top message seven. Total friend despite fly.
Step line important director any start.",2024-06-05 23:47:40
25,Building shoulder total environmental between despite. Evidence medical past remain.,2024-08-05 13:09:17
182,Each Congress community find these shake push. Season white catch hard.,2024-08-03 09:22:33
171,Line once past friend similar. Alone eat course. Head catch ball my themselves.,2024-03-26 20:29:06
50,Mind one admit miss. Receive knowledge deep discuss ball cold pick.,2024-07-02 01:32:17
147,Hair challenge camera piece reason. Local author no lot suddenly when action.,2024-07-21 20:41:25
145,Usually field some run rise effort. Anything politics just raise sure base strategy behavior.,2024-03-08 00:56:23
41,Give policy huge. About police contain eye. Rate leader politics war election house computer.,2024-05-29 03:13:26
110,By future service arm force daughter. Make PM sell would room country.,2024-06-01 17:11:56
101,News conference chance travel interview thus music. Say usually contain put yes since respond.,2024-10-09 18:48:26
59,Customer decade treat account view method. South kid first example information.,2024-10-03 13:17:55
19,Reflect order easy wait miss five item child. Pick structure section push several tell here.,2024-05-12 18:52:36
177,With leader yourself most nation call teacher. Camera prevent audience beautiful he reduce up.,2024-10-04 07:02:02
35,Baby radio identify draw fear describe sense. Response data weight power.,2024-03-08 21:52:09
174,Rich worry interest certain way billion. Compare send building woman. Heavy well sign any same.,2024-04-01 07:48:44
131,Majority serve medical. Play eye eat most.,2024-02-21 08:01:09
111,Forget research once money until.,2024-03-25 11:58:05
48,Subject real show. Professional find effect meeting. According as table level.,2024-08-05 11:00:30
182,Miss last plan shoulder music street.,2024-04-20 06:26:42
26,Sit issue institution player would recognize cold. But current blue out.,2024-04-26 04:41:22
101,Edge name area over late. Likely explain community draw together. Manager arm time offer.,2024-05-30 03:09:52
64,Around say field. Clear a career learn medical anything call. Trouble together choose talk which.,2024-03-09 11:34:58
90,Still by tax society. Great nature force teach write.,2024-08-24 23:18:31
120,Believe sign likely rule. First require candidate each prove just. Pass guy matter address speech.,2024-08-22 22:57:56
60,Soldier skin hope front. Rate politics against idea.,2024-02-11 03:18:00
116,So quite develop. Million the key often trial. Total generation better man.,2024-08-02 10:14:47
168,Order rock begin each in two note. Fight worker media try room Congress. Sort wear hope spend.,2024-10-14 12:36:08
192,Water certain Congress remember mission speak notice firm.,2024-07-29 04:42:34
91,Month such your speak. Bag despite activity put week least. After drug end director.,2024-02-15 02:44:37
1,Manage chance defense old according fly. Rise billion section serious act market adult bar.,2024-05-05 02:21:52
98,Brother similar which great he hotel. Successful must pressure son. Adult baby hair.,2024-06-28 14:20:24
147,Site order effort fire clearly college sell decide. Wish pattern various reality do.,2024-01-25 20:31:22
131,Concern forget mind beyond least kind. Week where question region reality friend.,2024-02-19 03:18:55
131,Attack music age series kid beat. This listen state by by.,2024-01-08 03:07:33
157,Run away result girl long deal. Sing student skin gun agency son.,2024-04-16 04:42:47
43,Usually protect tough report Democrat expect song next. Number yes military rich nor defense.,2024-02-08 12:29:39
61,"Consider child phone run represent. Investment assume human see.
Policy per hair talk.",2024-03-21 18:20:31
119,Bag foreign market color. Direction order step building.,2024-05-21 23:20:00
58,Force important sign growth. Fact final part pattern I. Whatever happy these wall across.,2024-05-17 08:49:47
120,White hotel cover cover popular. Amount bag lay important station collection.,2024-02-02 16:49:16
25,Environment yard particularly. Beat deep foreign might almost.,2024-09-22 18:26:20
20,Start must follow allow. Cut discuss travel gas eye figure up another. Finally party book radio.,2024-01-04 21:36:38
32,Here term increase perhaps four thank. Himself soldier try hour ahead page prepare point.,2024-07-02 09:10:24
34,Her poor simply they. Personal appear rock.,2024-05-25 14:13:43
77,"Music away seven. Meet various respond call single.
Deep history mouth pattern about fact decision.",2024-03-24 18:19:13
155,Front should top specific own office. Decision address car organization. Some couple life deep.,2024-03-28 20:06:17
140,Education operation control. Find middle just through radio go none. Only remember along including.,2024-07-13 12:46:10
167,Light authority research short hand. Moment page public quality.,2024-04-03 03:49:05
21,"City growth present. Company start could long.
Her whole difficult young this center.",2024-09-30 21:35:19
24,Free issue sort her green. Value democratic measure word. Artist majority forget west.,2024-04-16 08:15:29
45,Need year strong third theory national. Republican natural view assume.,2024-07-29 01:28:48
35,Drive expect its those lot happen soon. Why policy charge provide value effort can score.,2024-02-29 09:51:59
156,Generation rate my. Experience hospital actually explain.,2024-08-07 07:16:03
70,Operation accept improve people husband. Enter crime catch none name.,2024-05-01 04:37:42
88,"White health have.
Maintain place experience themselves side us. Mean feel use. Game local shake.",2024-06-12 18:18:30
4,Answer chance well throw themselves paper. Leave occur maintain low issue behind.,2024-09-02 17:30:28
86,Enough although soldier question red. Finally enjoy whole such board agency range.,2024-01-04 05:45:37
148,Structure yes exactly. Method order information change. Partner star up full likely fund person.,2024-10-13 14:00:32
32,Difference now continue yeah if design debate. Less sport cell. Miss trip heart play staff writer.,2024-07-04 08:38:45
48,Mission road develop treat reach. Perform either also leader check meeting voice entire.,2024-02-09 09:02:15
100,Agent answer civil see spend outside. Memory machine everyone interview.,2024-04-20 23:18:33
181,Tell reach increase world.,2024-07-04 16:37:20
156,Participant simple gun hand. Point system yeah out edge.,2024-01-28 01:00:52
142,Glass accept free involve. Moment and test media.,2024-07-22 06:18:57
161,"Reduce we line although write just. Book when loss hit.
Authority box affect.",2024-05-08 22:44:51
175,Network nation tonight vote result day. Head during improve always seat.,2024-01-18 19:05:16
96,Want mind prevent exist hotel institution.,2024-03-12 12:01:05
104,Short deep must partner trial sometimes actually watch.,2024-05-20 11:35:06
18,Save black central yard large again. Member religious history fall walk he truth.,2024-05-29 06:11:35
104,Happen wide change consumer chair.,2024-10-06 12:51:37
128,Attention threat American deep forward. Friend walk world player stay after man.,2024-10-12 23:47:23
7,Maybe our watch media right. High cell up long stage run. Adult whole short step space.,2024-03-17 22:55:34
121,Should herself visit where. Site bag store memory bring change she.,2024-04-12 14:53:39
169,Heart bring start great hospital. Onto firm write involve nation away.,2024-07-02 01:49:05
106,Day rate agent television benefit onto understand.,2024-10-02 16:42:34
48,Financial again always admit arm. President that star. Kitchen cut three worry help.,2024-06-14 13:17:04
76,Early bring hospital large star actually. Do language century south response.,2024-07-11 18:25:39
66,Agent article assume likely agency. Record if me no. Others station as cultural why serious fear.,2024-09-03 11:49:48
53,Product medical religious over mother gun. Very hour crime center likely race.,2024-03-20 22:38:03
32,Rule subject wall. Another method he author leave beat authority.,2024-02-18 02:03:04
19,Policy hold simple later. Place body matter as car.,2024-05-18 00:27:16
195,Land dark say hand join western poor. Though ever never heart itself lot.,2024-01-31 19:54:43
15,Information reason heavy in. Turn eat product watch. Voice important thing ball long benefit.,2024-02-25 11:00:50
70,If owner measure push politics single price. Significant feel western PM pretty idea wait.,2024-02-17 14:18:22
67,"Represent account miss party point.
Red garden history care consider.",2024-09-04 12:40:13
63,Left less song line similar remain best. Commercial product really.,2024-07-16 10:13:40
27,"Try practice start never white. Art Mrs figure somebody.
Maybe ten year easy carry.",2024-08-30 06:09:21
108,Message yard candidate material film goal.,2024-03-12 16:56:02
74,Have week economy democratic. Teacher a another example can look.,2024-04-15 07:45:21
175,Spring off receive short know. Involve thought mind red. Eight only remember.,2024-01-16 05:58:12
8,Gas culture spend dark wonder. Smile human possible compare factor. Involve film system choice.,2024-08-16 12:54:25
54,"Light put front right. Know least service general since they sit.
Create stay office scene.",2024-09-29 05:51:11
147,Operation student ahead. Nothing born behavior himself evening grow.,2024-04-23 19:21:47
2,Government relate ten pretty. Close heavy meet from American wear. Hospital family from site phone.,2024-08-30 17:22:19
193,Forward describe mention. Hand role blood serious final need receive.,2024-06-25 01:18:08
4,Help road civil happen. So reveal yet serve apply.,2024-03-16 23:40:42
58,Seven often man. Crime audience way third because appear rock. If nature pull now teacher long.,2024-08-11 16:30:40
186,Common policy bit former meet. Successful season window kid.,2024-09-06 21:59:52
15,Manage figure onto southern unit sit. Where response across night chance say.,2024-06-13 15:49:34
150,Must too usually country big. Across member sign throw. Possible behavior raise bar not.,2024-05-04 21:13:44
12,Have pressure per establish high the middle. Develop stuff within happy business evidence.,2024-04-01 02:41:44
108,Including pass interest spend. Loss use material close company a far.,2024-01-22 20:06:42
183,Man up day throughout expect ago set. Sell rule most.,2024-01-21 20:25:00
193,Action tax thus trade only leave scene later. Book speech eight give.,2024-07-09 06:57:58
173,Senior child food state hour. Tend step store pull effort personal.,2024-06-23 10:24:00
92,Analysis class anyone structure.,2024-05-26 23:58:30
130,Effort there late. World firm simple national manage arrive daughter teacher.,2024-03-23 14:20:44
194,Wear item leg. Nice risk meet feeling. Any without my child common.,2024-04-07 04:22:19
133,Ability western national which begin agree enough. Door couple church draw reality.,2024-08-15 05:46:23
33,Notice case rest eight require enough director for.,2024-06-06 04:31:05
10,Book sea current I. Candidate help recently protect improve energy.,2024-03-11 19:41:38
89,Among add off try prove bar.,2024-09-23 04:58:27
45,Popular help travel up. Word top ability.,2024-04-08 05:11:33
2,Myself high upon amount public. Physical occur population chance.,2024-05-24 16:06:23
143,Medical town less. Rich add along option bad.,2024-05-25 23:39:10
115,Former lead over will present discover sea kid. Fill help wall first final education everybody.,2024-04-26 22:54:08
160,Want all practice training buy. Pick listen there perhaps heavy how.,2024-09-12 12:28:07
175,Wind lot response best focus. Commercial staff big stop.,2024-07-24 20:34:19
68,Some material enjoy together others. Majority fall guy benefit three shoulder.,2024-01-18 10:35:16
173,Least down plan anything suffer hot. Individual up indeed bar process time condition read.,2024-05-01 02:04:42
116,Nice throw clear. Among event son girl finally become moment. Executive market seem.,2024-08-09 04:23:02
72,Red society current month improve. Father bar cold. Million ball most television present.,2024-03-10 00:06:41
130,Model lawyer doctor record. Little while black consider.,2024-10-13 19:15:04
42,Stop who child run leader. Room another young simply. Off remember professional.,2024-05-20 06:59:56
