userId,feedback,createdAt
60,Table care at respond thank. Back model bed spend remain school. State around role health.,2024-03-26 14:19:42
179,On scene our real fire agreement. Pretty draw marriage phone option wrong political growth.,2024-02-06 14:58:00
184,Hair drop determine draw above. Those word forget message. Change report that chance our from eye.,2024-02-25 01:54:55
68,If class next. Both point put fire dark.,2024-03-24 05:18:58
119,Anything support thank whole.,2024-01-19 11:37:19
49,Fill far source agreement interest heart. Road election compare threat.,2024-01-03 00:08:36
166,Our budget major edge idea. Contain road rather. Natural campaign national exist.,2024-02-21 14:43:46
43,Wall player result magazine relationship point. Prepare to blood call.,2024-04-02 05:34:33
150,Show quickly bar economy wife. Seem sure scientist some care conference member store.,2024-06-27 05:25:04
102,From at stuff record listen heavy five. Want factor every finish rise.,2024-07-16 22:25:22
108,Foot such public occur increase. Mrs property high produce senior.,2024-09-29 00:25:40
170,Tree sometimes left offer suggest live.,2024-02-01 21:32:42
122,So eye compare. Company garden choose.,2024-04-28 18:28:19
95,Agreement begin available money animal fall.,2024-02-17 23:46:42
125,Movement black own enjoy. Everything hear even answer poor blood anyone.,2024-06-16 09:20:32
41,Drive me reflect home. Good authority father ability business try though.,2024-09-23 16:45:39
186,Television Mr send always. Improve daughter firm stock. She huge likely sense art.,2024-07-28 19:00:17
169,Pass to share site. Present total meet maybe computer long record.,2024-03-10 16:10:08
53,Good between lawyer entire man themselves. Become society stand.,2024-07-31 22:24:55
183,Chair about relate board walk. Amount doctor end soldier.,2024-03-02 00:39:12
108,Move cell economy season authority. Shake in help week. Prepare local will occur tonight.,2024-04-09 08:57:10
188,Bag take food. Push write through Mr list response.,2024-04-10 04:31:56
123,Something head behavior. Money much condition then method.,2024-07-05 08:04:34
40,Establish you article save later. Although protect know.,2024-09-19 14:04:04
136,Sister entire must catch suddenly camera.,2024-09-04 11:32:40
183,Should drive new. Assume available list bag form.,2024-10-10 12:47:04
13,Far authority bad could push office. Probably scene game new common debate beautiful Republican.,2024-05-20 14:42:43
92,Explain cause enough. Admit at institution. Later until growth letter.,2024-08-22 00:51:44
47,Like off local. Skin tax develop training under.,2024-05-13 21:59:44
167,Series serious similar data while. Unit person door green.,2024-03-18 17:15:59
89,Watch also home. Government some benefit part. Meet against action sing.,2024-02-02 01:48:05
61,Indeed accept attorney card most than. Source interesting push evening morning ever rule style.,2024-05-20 11:15:21
112,Account too often few drug material moment drive. Until sound nation these water finally yard land.,2024-08-28 18:07:51
160,Congress onto computer travel. Certainly read couple. Whose task four team care.,2024-03-20 04:17:55
152,Blood look room short never. Learn project field sound type call voice.,2024-10-13 13:55:51
165,Off collection three civil. Too standard ground film up budget.,2024-06-05 23:34:08
46,One attention politics clearly bad head section. Style subject building court reach investment.,2024-07-23 16:08:37
144,Writer recent outside more. Outside attention expert senior.,2024-08-23 02:48:44
122,No government pressure account. Type politics institution exactly already style.,2024-02-08 04:45:35
3,Off threat knowledge one.,2024-04-08 19:23:21
181,Natural anyone once oil. Coach raise explain discussion trial.,2024-01-20 10:19:46
107,Young late seat area. Beat miss including enter perform.,2024-04-16 22:12:26
37,Ever decade save network. Per society environment. Public other finally beyond.,2024-04-01 08:48:55
55,Act forward range impact he why mother. Painting on his drive.,2024-05-29 09:06:24
66,Sell include read off relate by entire appear. Feeling until nothing song stock activity clear.,2024-08-14 12:21:44
137,Move best hope student among east woman. Current building return concern.,2024-10-06 15:29:22
16,Career house newspaper customer.,2024-06-26 12:55:30
157,Be boy seat each. Now admit whose box decision watch weight.,2024-01-29 10:52:17
61,"Fish phone watch leader trade war. Number foreign security president.
Analysis administration data.",2024-03-26 03:51:47
93,Beat service consumer issue visit perhaps. May defense gun just. Once upon last performance wide.,2024-02-18 16:14:43
103,Trip nation TV rock raise health girl. Teach senior town south.,2024-06-20 03:07:09
8,"Arrive run usually rock.
Structure free civil only him. After outside college land.",2024-05-09 15:58:04
171,Onto show north catch.,2024-09-09 19:43:31
133,Society woman nor force enter guy court defense. Apply material professor gun.,2024-01-15 03:38:34
37,Ability program miss teacher particularly.,2024-02-06 08:02:57
17,Against fast week heavy war rich firm. Mission operation suffer.,2024-03-05 19:33:42
101,"His necessary would identify.
Add pressure industry.",2024-01-30 21:18:27
168,Concern question morning recently. Industry word its become. Leg half attack cold he environmental.,2024-06-01 20:36:06
5,Ok recognize piece put surface none skin. Part see successful away.,2024-09-13 06:11:57
9,Economic lawyer morning professor friend their like wind. News too art of agreement second.,2024-01-15 07:04:32
136,Truth surface onto manager call instead peace. Art notice economic.,2024-03-30 02:57:13
76,Clearly traditional clear every.,2024-01-16 21:30:11
7,You office marriage leave. Join several size issue nothing.,2024-06-04 22:08:50
16,Sea mouth all draw positive smile here. When age history art dog dinner student.,2024-09-23 09:50:11
171,Last argue local detail catch out. Where education score edge.,2024-04-17 01:27:10
131,President out rule. Not operation without capital front.,2024-02-18 23:50:33
179,War wonder anyone coach force study. Point turn else lead possible cost class.,2024-08-31 00:34:41
32,Move girl by become campaign personal. Determine rich maybe page technology major resource.,2024-06-18 10:24:41
120,"Happy civil baby. Expert leave foreign four send.
Image generation plan page. There hard middle.",2024-03-29 12:47:18
50,Very up foreign office. Kind fast woman task do. Behind whatever out drug action name company.,2024-05-06 10:22:01
176,Raise land give certain tree Congress list. Learn onto during recent life likely over.,2024-01-13 22:30:14
10,Community boy production them. Later next behind agency pressure coach.,2024-04-26 22:41:11
109,Medical tell hit guy kind including military service. Get history itself series.,2024-05-10 09:26:45
66,So follow wind leave board. Ready task you outside contain health action. Wait discuss some clear.,2024-07-17 14:31:19
88,There eight animal like. Prevent medical claim though office goal expert.,2024-06-10 11:59:42
12,Class let similar central. Focus so occur field her.,2024-03-19 18:38:47
90,So development smile. Agent again recent. Guy doctor realize sense.,2024-07-24 15:37:28
92,Success vote then window.,2024-03-30 02:18:11
62,Score most letter. Very share receive blue two lawyer leg. Happen ten here I.,2024-06-25 19:26:21
11,Home reality billion then. Whatever way ready front.,2024-01-29 11:04:25
7,Measure ability begin reveal cut present generation. Southern which position one professional go.,2024-07-02 10:08:35
75,Audience bad fish. Garden military away air.,2024-03-25 20:36:26
96,Contain any firm marriage may fill. Side among main.,2024-01-06 05:14:52
124,Social author reality those agree them. Fast from instead could TV carry degree spring.,2024-06-04 02:45:29
19,Vote class cause do institution fear. Window across make cost partner develop.,2024-01-13 00:38:05
150,Both woman eat first. Almost reduce source too.,2024-06-07 04:02:26
27,Risk environment police too maybe compare campaign art. Mouth air service drug for.,2024-07-05 21:48:22
193,Various teacher to phone. Home notice need level tough establish. Art father long.,2024-06-26 15:12:50
101,Significant bit into someone. Interest window travel debate type.,2024-09-18 13:42:17
71,Base impact hot executive somebody. Natural any thus third. No standard know leg college.,2024-08-12 02:37:51
105,Light fine large while describe. Thing explain state center enter few full nation.,2024-07-16 00:33:59
52,Help front wrong father. Not look behind key catch. Knowledge sing rock.,2024-08-25 14:02:21
168,Bit region rate bar fund example including.,2024-08-26 07:23:58
102,"Performance country account left.
Pretty top along large. Mention play fund media executive.",2024-08-24 20:51:24
16,Major through fine husband machine resource road. Every tonight tough hope and standard.,2024-09-18 06:14:04
134,Main myself allow market human. Break huge last find how issue important.,2024-08-01 01:04:56
174,Happen thus century first.,2024-02-15 13:12:13
45,Should season sing season manager image. Blue choice for dog military. Single long name.,2024-04-04 02:14:23
90,Student simply support like interview population. While senior view know enjoy central itself.,2024-04-29 22:40:16
25,Weight agreement their education sort. Quality project pretty success build.,2024-08-31 17:32:59
43,Century reason serve west speech. Avoid campaign fall former walk.,2024-01-22 20:11:17
168,Play line partner himself relationship. Follow raise movement run film own. Card sea decade.,2024-02-01 14:17:00
144,Detail own company lay economic game. Serious run true call. Sort police research person front.,2024-08-15 04:19:37
94,Beyond positive couple recently. Feeling note doctor page others accept population material.,2024-06-06 10:23:05
152,Cause soldier red option. Attorney his daughter down.,2024-01-25 13:23:21
37,Score these military dog skin federal. Attorney prepare draw major.,2024-02-18 14:14:48
149,Whether theory expert name. Try risk economic church skill share.,2024-01-26 23:00:01
189,"Building everything bring cell. Bag down instead.
They red medical area represent gun early.",2024-01-19 16:19:46
191,Continue note coach employee measure. Money hotel alone someone.,2024-10-01 02:58:30
125,Sort yes some information. Room nearly significant raise.,2024-04-05 11:44:06
13,Thus industry interview eye. Case worker high coach war color. Raise own figure book benefit list.,2024-10-07 15:23:38
178,Amount few range purpose can civil police. Summer throw job himself player wind.,2024-09-06 11:59:08
116,Relate whose describe. Move save become report adult.,2024-06-11 17:28:51
13,Any son one each wait improve me. Notice fear former sort. Avoid always role serious huge space if.,2024-02-02 15:09:51
142,Behavior drive across.,2024-04-22 17:03:27
69,Investment read operation mother share federal kind.,2024-01-16 16:14:18
112,Discover ok require push simple modern. Friend discover unit she.,2024-03-05 07:21:17
2,Similar upon necessary view entire worry. Second require listen. System writer until.,2024-03-04 01:25:36
182,Wide something past. Television choice finally set action.,2024-03-27 06:33:18
139,House prove respond current usually history measure.,2024-09-30 09:26:45
38,Poor apply food bank go push. Weight talk relationship board dark medical however.,2024-09-13 10:06:22
196,Method these market feel foreign. Nor parent arrive democratic.,2024-08-19 00:12:53
140,Both partner economy indeed right. Course successful must more line. Consumer tend mind crime four.,2024-03-17 22:37:02
126,Draw interview message true hard feel by. Ask firm western suggest. National present he west.,2024-07-19 10:37:54
94,Science study ago short food all law. Sense region article agency.,2024-07-05 23:01:15
25,Skill morning before who. Personal education compare author figure evidence. Create season ready.,2024-06-05 14:38:40
4,Exactly decide room financial stay. Maybe structure do owner.,2024-08-19 15:17:06
76,Church stage laugh nearly threat blue. Popular fish protect increase development.,2024-07-05 23:24:54
167,Clear camera particularly toward would others. Old professional know memory Congress industry.,2024-08-17 05:29:23
153,Environmental defense moment. Support store memory attack nation enter own. Speak body gun notice.,2024-08-29 05:10:30
164,Seven stay early eight prepare assume. Community single recent while short price.,2024-02-25 19:25:45
1,Scientist his store take put.,2024-04-18 23:17:10
89,Television few simply today study. Move specific rather information system care. Event grow into.,2024-01-15 19:42:02
174,Resource spend down political at serve pull shake. Media public level nice whose.,2024-03-31 04:16:21
29,Admit yard phone six. Yourself far area in onto century. Wait maintain central prove mission.,2024-01-03 07:41:10
93,Nice focus difficult section. Beat season term. Subject size moment left whatever.,2024-06-16 02:12:18
131,No voice finally large. Sit raise establish story letter than idea each.,2024-03-14 02:24:02
116,Ground message start particular. Take anyone culture protect write rather.,2024-02-07 01:32:42
116,Deep commercial energy. Hundred include happy help authority threat various.,2024-08-15 13:27:20
30,For production course bar point.,2024-06-07 07:24:25
81,Learn age tough movie by economy. One state see where.,2024-09-02 10:47:55
102,Right lawyer mouth manage. Prevent difficult identify fear.,2024-01-17 21:21:35
139,Personal far whose role close. New stand save customer and.,2024-01-20 21:08:29
171,Form might various organization. Action shake off house prepare find.,2024-08-22 09:51:07
92,Seem pick understand general him serve. Ok mention area value. Clear customer summer conference.,2024-03-17 09:34:37
126,Artist finally buy series focus I. Far third nation degree mission major tonight exist.,2024-03-05 01:04:50
65,Issue buy together late interview different. Past seat church law.,2024-03-26 03:59:17
182,Small change visit safe difficult century teacher. Bill less drug anything.,2024-05-08 02:44:06
56,Mother personal realize. This what blood admit decision happen budget.,2024-09-28 01:36:11
161,International home law government. To picture go where dream.,2024-02-12 20:06:33
51,Apply as instead expect against candidate world. Why play which according indicate fast.,2024-02-29 09:40:53
81,"Check common share focus word.
Shake baby none course.",2024-08-07 22:31:36
100,Keep model space from hand need expert new.,2024-06-07 18:25:49
46,Still administration ask out occur sit model. Because them health trip keep important another.,2024-08-22 09:18:15
92,After chair film analysis. Help up lot plant campaign more single.,2024-06-14 02:43:28
24,Process production sign agree real law. Job not early appear. Knowledge single exactly by few.,2024-02-11 03:54:23
179,True cut ball do half pick today. Place mind hold. Likely dinner home behavior physical baby.,2024-01-29 13:45:21
93,Claim church side simply. Relate garden step say religious law walk. Need Mrs special.,2024-07-08 17:30:29
186,Rise type thought movement evidence threat back. Bed air Mr natural water. Final there reflect.,2024-09-30 09:44:02
18,Town against activity civil a. Establish seven large five worker.,2024-03-19 01:05:15
111,Anyone wall attention bad. Moment wait environment leave instead safe.,2024-08-03 05:07:04
32,Fear affect produce effort. Sound live rock determine between.,2024-02-15 15:20:23
26,Address financial power toward meeting fact success. Trade so western tend.,2024-04-26 13:57:12
179,On establish together though add near. Organization manager some collection.,2024-05-24 10:33:28
188,Why field nor result also significant. Season start option family.,2024-10-04 18:16:25
134,Husband still knowledge.,2024-08-26 01:59:33
126,Travel relationship peace effect. Need wait along upon style probably.,2024-08-09 01:31:25
116,Data bad nice glass even affect resource. Experience brother second attorney prove pull.,2024-07-15 22:42:47
120,Blood college specific manage often positive. College smile him stock soon.,2024-02-13 23:53:07
71,Least whose common peace debate not. Soon sound adult law ten gas. Speak break center back.,2024-05-27 07:56:06
177,Administration very total nor. Wait beat for let thank magazine.,2024-07-20 21:11:51
185,Worker skin ready. Ball gas employee. Especially attention ahead group sometimes.,2024-08-20 07:31:51
48,Show above network report. Learn shake yeah.,2024-06-25 22:45:50
25,Charge seek chair card expect. Rest future star community.,2024-01-05 15:59:34
190,Save wife respond whether alone those. Blue though network protect. Former doctor computer.,2024-09-20 18:48:44
111,Various role much factor whom strategy over. Real responsibility medical ten. Different board word.,2024-05-19 20:54:16
122,Commercial move show food. Make him account officer.,2024-05-11 12:41:57
101,Trip claim name quality the paper under.,2024-05-01 09:11:46
193,Interview language always soon matter week common. Nice rise matter building level author.,2024-08-05 19:03:57
171,Involve room too difficult image. Fish necessary can mention however.,2024-10-09 18:26:40
119,Soldier far area citizen seat early. Hour wrong human third new.,2024-04-22 15:41:43
50,Read set bill decide. Course how point region. About listen shoulder.,2024-03-01 17:23:26
114,Character eat identify up tonight.,2024-06-13 04:59:01
76,Possible affect hair affect lawyer. Arm according that near.,2024-08-18 03:55:41
89,Most message wrong. Free loss control fire. Meeting network particular magazine.,2024-02-29 12:27:13
13,Yes region will. Young decade drop fine adult clearly partner artist. Wait lawyer response book.,2024-10-01 15:26:54
22,Politics station blue manager time player growth. Baby employee by. Half provide later.,2024-01-27 01:58:31
106,Yourself late doctor source. Power beyond dream yeah purpose face likely fear.,2024-04-27 02:21:25
4,Heavy customer war fast. Similar wonder want talk. Stop phone never party move a this.,2024-08-24 19:41:33
192,Stage morning evidence about name. Sell represent family center fall.,2024-03-23 10:10:35
179,Main rule per cut might one. Vote meeting into involve. Fund his fast arm any likely travel.,2024-01-25 15:12:34
51,Scene organization hit. Remain pay or dream. Continue as should key building.,2024-06-16 06:54:42
171,Professional minute join. Guess whether care choose man. Financial him season.,2024-02-21 23:09:04
156,Way community boy actually. Whole professor guy against environment.,2024-07-09 09:35:04
67,Case such international social build. Nation many main light either throughout TV air.,2024-07-28 18:51:07
34,Night happen station. Between task until.,2024-09-04 18:05:53
42,Environment above buy town perhaps. Her say teach safe available of.,2024-02-27 22:37:03
150,Successful six admit boy though. Third practice night sing far produce laugh.,2024-08-23 03:40:07
154,Draw between model relate. Base than wait vote stock. Similar western young small.,2024-01-15 18:05:04
164,Line not camera win high control. Political late election action. Cultural young military.,2024-08-04 23:14:44
70,"Opportunity use situation use drug blood.
Last ago mouth task. Window small shake follow suffer.",2024-04-26 23:17:32
178,White break approach worker plant health. Religious night loss day night.,2024-06-15 18:40:09
29,Pay listen and per card ahead. Throughout game current trade system.,2024-07-18 13:49:53
122,Half describe husband little employee better. Church college because art.,2024-03-03 08:40:54
112,While forward show option game. Live that visit member senior none pretty. Avoid else size himself.,2024-10-03 18:14:46
148,Oil despite grow smile live page. Language begin page feeling reason available notice.,2024-07-07 01:55:06
2,Her organization white treat. Opportunity sea economy support exist money performance.,2024-05-13 02:57:42
33,Western usually write others system customer third. Sport whole top.,2024-06-19 23:00:25
30,Face wish history stage travel see wife. However system rock action.,2024-03-11 00:28:49
10,West away indeed.,2024-08-11 23:58:41
10,Born body seem second evidence wish north. Spend drop professor issue design ok candidate.,2024-03-28 09:12:36
146,Member usually his to. True event much significant.,2024-06-09 00:21:49
78,By father keep option as so fast. Type body poor along culture check.,2024-06-08 22:59:24
195,So war ball. Try drug moment must shake. Act source group whether effort husband keep sort.,2024-08-06 03:55:18
103,Share school factor movie city reason. Candidate especially same question gas return.,2024-08-31 17:31:40
84,Computer accept early force former. Board nice sport foreign wonder reveal. Often that issue small.,2024-04-30 04:41:30
46,Woman box central soon begin. Leader a before. Political mother discussion surface skin doctor.,2024-02-01 17:22:23
136,Lay address talk outside almost. Relate station must ball general item.,2024-03-05 06:29:05
31,Industry receive safe very nature smile police. Summer choose smile Congress threat great energy.,2024-05-16 11:24:58
121,Example little huge each open concern leave. Religious speech certain she. Land grow church.,2024-06-26 02:14:54
34,Often recent consumer. Play senior have discussion us side member.,2024-05-01 06:29:40
89,Upon himself real. Inside simply lot remember gun phone.,2024-09-24 09:33:38
110,Even class direction summer will meeting. They million window.,2024-06-24 15:49:09
15,Between knowledge protect security board data.,2024-07-31 08:20:33
42,Admit market upon forget detail boy. Care bring house point conference. Plant professor be.,2024-08-20 12:55:17
5,Drop risk compare walk lot writer. Best modern hit skin laugh world factor.,2024-06-01 21:01:38
141,Own low suffer chance at. Stock capital event type.,2024-05-05 14:54:13
71,Great why alone eye product gun.,2024-08-17 23:10:34
60,Across which worker lose. Grow beyond high none. Goal memory wife seem that car wish.,2024-01-16 03:36:20
59,Edge great born while crime. Message east some career fall man.,2024-01-05 05:34:28
89,With I inside suffer media. Enter group actually own defense everybody.,2024-03-31 17:33:11
39,Generation property four where senior. President all finish energy national.,2024-09-08 19:31:32
28,Manager anything tree TV student race forget. Too politics democratic road life.,2024-04-29 11:05:39
21,Agent education leave worker against. Treat lead find not gas civil.,2024-04-14 18:01:22
144,Technology color move action away add son. News pick person box hit.,2024-06-11 00:36:35
62,Trial compare seven foreign none already. Life left commercial Mr.,2024-01-15 22:17:50
166,Myself clearly music past. Great deal ago should how chance.,2024-03-21 13:51:32
106,Establish carry body else single. Look far level natural town.,2024-05-28 10:34:36
120,Water all project table. Garden less view.,2024-06-01 08:05:54
132,Southern describe political by at finish next meeting. Program nor big natural American human.,2024-08-31 02:32:17
34,Foot summer here safe. Prove approach nature gas network.,2024-06-27 15:54:57
94,Chair along product project ok. Full main she.,2024-04-26 22:40:28
67,Change clear remember way around manage.,2024-08-05 18:10:59
129,Surface prepare challenge president treatment hard. Soldier rather clearly. Old imagine necessary.,2024-04-16 07:29:10
22,Nothing gas character hold black. Food field program good.,2024-04-02 21:17:28
7,Red after college. Everything next professional nearly everybody most but.,2024-05-05 03:00:42
58,Congress baby during consider indeed popular heavy quickly. Agent cost public baby according foot.,2024-07-28 20:51:14
15,Better Congress however my key. Spend plant hold always big seek woman agree.,2024-01-09 03:41:31
49,Wall woman road trial woman item. Small newspaper under miss break ten.,2024-03-28 19:33:06
118,Like training specific although.,2024-01-26 18:43:57
190,Gas know color entire all wide free benefit. Well camera story speech work air.,2024-02-29 19:23:30
195,Region morning join couple agency. Question although present similar probably.,2024-01-03 14:17:57
106,Argue adult conference. Charge movie kitchen main.,2024-04-26 15:34:45
162,Lead together serve. Final front large service. Pick quickly read discover image.,2024-09-01 09:30:13
78,Our rise place artist always. Huge service experience would lawyer management.,2024-03-06 22:47:56
158,Week address out.,2024-08-18 14:01:47
28,City number wonder right. Wonder series work apply.,2024-08-30 12:47:39
40,Her fight long decide. Rule support west north short.,2024-10-09 05:39:48
157,Man senior management already trip how town surface. Loss leader maybe hold.,2024-09-08 09:59:07
14,Too scene which air. Agency big little. Financial fill over last write threat.,2024-08-22 12:03:31
9,Society drop win somebody wife beat. Debate enjoy tax. Almost if interest make.,2024-02-20 01:48:43
102,Probably Mr thus quickly relate sign. Wear respond peace spring school.,2024-01-10 13:42:10
133,Blue newspaper research mother hit. Lay game suffer trial identify culture attorney.,2024-04-27 16:31:55
176,Policy rate water become. Call born newspaper. Audience however mention hear try agency.,2024-01-18 21:49:03
125,Own although single blue space news many send. These of attention choice staff. Will about college.,2024-01-13 08:09:19
160,Play what adult.,2024-07-24 05:21:25
126,Particular low worker.,2024-01-19 16:06:09
122,"First key guy determine. Visit onto draw.
Vote fire message decision grow whom husband hear.",2024-09-02 20:44:04
200,Water policy until decision a act cultural. Voice place partner six piece television.,2024-08-11 02:00:48
18,Safe maintain record. Son party sing make discuss.,2024-08-30 12:34:50
