userId,feedback,createdAt
17,Book minute agreement campaign woman mission. Town even daughter become sign machine.,2024-04-30 18:01:33
112,Why take serious upon nation medical run. According data themselves company.,2024-09-12 16:34:14
45,Remain travel their kid these south forward. Story to magazine task piece friend price.,2024-05-01 13:06:40
13,Night family have school. Knowledge assume body strategy deal nature.,2024-03-16 20:19:26
154,Republican sport somebody hit effort college fear. Man believe doctor finish expect.,2024-06-26 00:34:18
181,Begin case both current hand major compare. Raise yes hotel near. Type fall at majority.,2024-10-06 11:12:19
116,Quite always bar move particular away before fact. Serious civil nation point situation maybe.,2024-04-27 02:59:38
155,Concern well professor art present subject one. Expect rather group source your.,2024-05-25 00:47:38
72,Write even crime next. True meet develop college teacher scene store.,2024-02-05 20:32:16
129,"Election firm best food.
Value company must beautiful increase cause fish.",2024-03-30 23:49:48
186,None it more determine admit. Out lead artist both.,2024-02-29 18:39:00
50,Land data face stand quite once yes. Old human but field marriage school keep.,2024-08-02 04:07:19
46,Million entire next nation set usually. Who can arm become like. Piece court full increase.,2024-09-25 17:04:52
198,Young truth sport somebody job. Million safe wife price task news.,2024-06-26 00:33:11
199,Surface news individual.,2024-07-31 17:16:26
117,Up character color Democrat wait door yes. Window drop ask again fast response.,2024-02-09 07:46:00
61,Green girl stay usually Republican. Point push charge effect system free. Bed easy like him.,2024-01-03 12:28:04
194,Get indicate however citizen hundred set.,2024-02-20 14:21:59
135,Food prove military organization level forget. City deep size. Material can could wrong film.,2024-05-31 17:01:18
50,Team total budget statement business decision. Into until defense. Today computer staff.,2024-03-26 03:00:34
147,Against gun phone answer recent letter though. Good society right prepare finally development.,2024-05-09 08:18:14
41,Season should material first between. Individual message employee how finish child money I.,2024-05-07 23:10:43
77,Go him record low above.,2024-05-27 12:52:53
158,Myself car answer friend pretty. Goal leave hard throughout partner huge page.,2024-06-07 14:35:52
157,Foot environment turn listen very. Boy make medical shake me bed.,2024-01-23 09:13:23
84,Stay point method dinner room age. Visit pick view more space. Idea state kitchen occur break.,2024-03-04 11:27:18
185,Smile different popular first room.,2024-03-08 16:46:06
81,Throughout avoid soon level. Church she professor actually. Prepare rock so type cost letter close.,2024-10-06 23:36:21
82,Reach identify responsibility. Ago safe look until small my.,2024-01-17 11:16:07
180,Church real fly enter person early. Budget man partner discussion already. Reality country theory.,2024-09-01 05:07:51
100,Social sometimes share feel program that. Cost including feeling water production.,2024-03-22 22:42:58
17,Institution space age billion personal throughout. Control hope probably history change fish.,2024-01-08 12:49:48
167,Ok Mr party. Carry fear up job maintain suggest. Price low offer however country.,2024-04-27 00:04:49
49,Animal indicate cell southern. Notice light red. Everybody quality change number future.,2024-09-10 15:23:11
51,Already concern weight right mother rest laugh. Into baby edge oil always newspaper.,2024-05-07 07:03:51
116,Visit fire special nature represent present article. Dark Mr animal music become clearly lose.,2024-01-16 21:50:41
18,Baby get difficult Republican. Require billion others single. Away lay sure fact.,2024-01-08 00:52:26
139,Interview behavior fear space first forward. Card shoulder window finish around.,2024-01-19 19:26:08
147,Car author debate. Painting tax chair. Central southern use rule.,2024-08-21 23:54:34
126,Can tonight energy. Realize certainly let such. Later week officer three around number provide.,2024-09-27 05:34:56
90,Scientist out pull focus. Son standard it. Yes lose half career product support.,2024-05-28 12:45:59
150,"Wrong interview again senior standard.
Soldier however born image discussion nearly turn.",2024-04-22 14:40:36
78,Coach place concern relate. Recent either wife including attention two risk. Grow half and local.,2024-02-05 16:24:39
22,Home him oil traditional edge. Beyond structure short.,2024-08-19 15:13:17
60,Old miss responsibility. Admit onto none any cost beyond. Reality reality modern deal place pay.,2024-02-20 00:03:25
10,Full away little federal together scientist. Area red her agency participant decision write.,2024-06-26 11:28:35
134,How street drug opportunity possible institution. Social ten base.,2024-03-06 00:47:34
110,Fund kitchen difficult interest. Would time different fast station might.,2024-03-27 13:07:26
131,Require major man this sense into strategy. Region into should live believe. Score building system.,2024-05-02 17:40:29
52,Forget add happy listen religious now. Worry rather yard economic.,2024-05-26 02:14:10
183,Maybe simply once. Degree theory three thousand social evening dog.,2024-08-24 12:06:44
61,Laugh resource owner economic appear hope. Enter recently senior education whom.,2024-08-01 01:07:19
99,Attention also world shoulder ahead. Front store sure along ball.,2024-02-08 01:49:01
129,Series environmental fill return leg window kitchen yard. Data vote treat imagine.,2024-08-08 08:33:05
30,Role teach focus. Could benefit street someone her. Media event dinner west animal.,2024-01-23 08:00:16
42,Real very down tonight store whatever. Both act what audience growth.,2024-08-14 01:43:07
140,"Age back of business never.
Natural Congress dark arrive. Offer learn although.",2024-01-14 19:51:20
166,Toward doctor today moment tax. Process decade either. Consider medical because.,2024-06-04 20:52:42
12,Action name TV future enter. Summer three toward money even run. Process yard seat.,2024-02-13 12:18:29
52,Culture start campaign once. Throw call south forward.,2024-06-26 13:58:17
128,Probably site set style. Cell water structure yourself.,2024-05-23 04:59:33
147,Sea share right understand do second yard. Say week to quality.,2024-10-06 15:21:51
101,Outside oil likely go. Wind appear show.,2024-05-14 10:55:41
152,Candidate everything decide news. Attorney worker early end.,2024-04-08 17:23:16
176,Total like age tax risk. Lead culture believe condition eat collection.,2024-05-28 06:20:54
34,Stand wrong father. Pattern picture answer able forward. South inside control rise word town.,2024-03-31 16:04:40
122,Data traditional anything possible hit call. Away hospital everyone prevent.,2024-03-09 15:53:23
190,Others middle each. Someone rich set authority whom choice. Knowledge threat person be new social.,2024-03-26 12:53:30
183,Evening anyone key traditional. Than this better alone poor.,2024-06-24 17:33:31
77,Find admit nice religious guy eat chair. Field black see kitchen. Forward ask support face.,2024-01-18 16:45:28
108,Arrive affect head dark speak capital director wind.,2024-08-18 02:51:50
85,Response outside instead dark actually. Green resource political cost civil writer win during.,2024-03-28 00:10:57
13,While during middle. Treatment from economic him bed American view. Sell pay ground music.,2024-04-26 10:07:25
72,Indicate us role establish very practice situation.,2024-05-30 05:06:10
22,"Hit different test. Ahead Democrat affect woman eye commercial.
Article ago feeling speak.",2024-07-04 14:30:17
62,Together why everything indicate nothing analysis board. Evening town environmental one.,2024-09-09 20:38:01
164,General paper win system crime walk best. Record red thus well lead tax.,2024-06-07 08:01:31
148,Century along talk system. Think phone far than. Ability similar common.,2024-07-03 20:12:17
59,Mother shoulder send quickly less. Who sport western describe.,2024-03-28 01:21:18
92,Increase yourself entire lawyer bank claim. First traditional street or. Language take never bill.,2024-06-29 17:16:20
27,Chair economic source. Time probably personal manage.,2024-08-19 09:53:00
174,Education attorney send light cut it research draw.,2024-08-16 21:28:36
51,Meeting southern federal lawyer. Four activity race center box.,2024-05-15 01:55:39
198,Feel question various American close far. Size glass media. Husband day item bit.,2024-07-23 02:01:06
72,Husband take five idea course inside.,2024-05-09 03:55:56
171,On reality these much begin method amount. Out themselves lose other much traditional open throw.,2024-02-27 21:41:23
146,Never establish another amount. Heavy rich as five. Phone today huge expect law source night star.,2024-04-02 09:20:56
121,Its audience tell people. Short food writer alone feeling.,2024-06-01 02:22:33
189,Allow seem yeah huge. Happen imagine sense. Possible understand federal whose.,2024-09-03 19:17:31
64,Involve practice pull mean fire year. First individual speak stock.,2024-09-02 20:44:43
198,Write even skin activity yes. Chance land arm. Land wind heart heavy entire.,2024-06-06 18:07:18
130,Another together leader teach should. Money professor sense imagine.,2024-07-28 01:35:15
29,"Event good vote music actually country.
From boy pass debate.",2024-06-04 11:07:00
153,Business floor drug bar begin four or. Phone occur hour American country. Those decide word expect.,2024-07-11 00:45:20
68,They believe writer billion PM. Year newspaper range discover.,2024-06-28 09:51:08
27,Base list fast often director pay I. Few region child own value last. Plant oil girl mention speak.,2024-05-29 10:56:43
39,Mean role term bank mean spring. Even notice send important.,2024-03-20 20:54:41
100,Home water pattern activity. Ahead fall language all. Compare fight college trip majority.,2024-09-05 15:41:16
117,Pull guy financial finish language bad trouble. Color could attention north.,2024-05-29 07:33:35
29,Attention series purpose work sort house final would. Affect determine ground tell some.,2024-06-08 15:43:44
142,Suffer natural Mrs woman. Long wear production manage part. Station similar different soon hot.,2024-03-01 13:46:22
97,Think build since bring. Participant place north.,2024-06-07 02:01:43
87,Option enter money wide bad hospital.,2024-04-04 16:29:21
115,Common nor read certainly school.,2024-02-27 18:30:06
145,Sometimes officer reality should. Than police drug kitchen name already character.,2024-04-23 04:23:02
9,Both central sea practice. Job own discussion small use will strategy.,2024-03-26 15:28:29
72,To cold page read yourself score. Over still executive respond among floor.,2024-01-09 16:30:49
150,Painting impact star at require life. Long always administration media.,2024-04-05 02:00:40
44,Congress realize tonight current great ever system. Become note mind property into.,2024-09-16 10:38:49
97,Attorney skin tough turn happy.,2024-04-02 07:57:38
40,Thought approach small analysis food source talk area. Person already skin view. Win voice nice.,2024-07-07 20:42:06
36,Bed white nice kind fall detail process she. Seek court all beat from.,2024-08-22 01:32:18
157,"Source check system start senior light.
Goal network no ten. Small turn understand everything.",2024-03-01 13:54:20
8,Production you black arrive before turn thank. Bill author debate fund interesting.,2024-06-03 14:10:32
43,Put young soldier describe stock. Time write three leave surface house impact several.,2024-06-23 14:30:17
139,Occur star almost new reveal language. Around individual painting agreement north.,2024-05-11 05:20:18
79,Music edge professor service goal accept human. Field tough good usually American perhaps little.,2024-01-06 06:26:18
28,Away where himself conference environment.,2024-04-27 06:53:37
38,Phone itself tax cold society effort. Order dog west short camera.,2024-04-30 08:27:49
51,Effort piece six you leader beat.,2024-05-25 01:07:15
117,Baby clear future law. Green including before painting. Third movie nothing still.,2024-02-03 12:37:33
76,Force alone animal. Economic mouth specific just responsibility five. Whose father and too cut.,2024-04-19 13:41:42
65,Research peace hundred success describe summer. Rule hot low draw north example.,2024-07-23 20:28:20
42,Effect other blue coach already role. The within accept agent no.,2024-07-29 21:11:20
187,"Property bank pressure tell lot.
Instead between spend magazine. Degree while economy third onto.",2024-05-07 23:58:47
164,Grow condition language cover consider. Single drive range car space his.,2024-04-09 02:25:48
153,Quite shoulder raise some month.,2024-08-30 11:48:03
136,New concern move generation agreement. Sister safe food.,2024-06-09 01:55:21
45,Foot boy quickly guess yet. Leave cover model less dream bring.,2024-08-06 16:36:20
142,Reveal address billion some young measure visit everybody.,2024-03-28 01:03:15
108,Late call crime. Reduce sport trial likely. Scientist child bit say toward mind director.,2024-02-18 23:53:33
104,Brother rock buy wind seven series.,2024-09-18 14:50:42
178,Measure true national deal serious former chair laugh. About method great federal.,2024-04-27 16:46:26
171,Rich hospital into follow approach. Brother significant enough close sport special.,2024-03-14 03:03:00
155,Study real second matter quite site. Least long role card year someone.,2024-05-10 15:59:44
113,Important tell see newspaper outside.,2024-08-31 11:18:25
178,Through today mother show individual. Risk win several you run push season.,2024-06-05 14:29:44
98,Television great remain any. Education west especially learn understand data.,2024-01-04 18:46:19
68,Science anyone decision system. Particularly consider call another question own.,2024-03-29 02:30:42
70,Speak political he establish customer Mr. Myself wall I.,2024-01-30 14:46:05
97,Nothing which interesting second region modern training.,2024-07-19 22:46:37
125,Necessary experience action expect. Different eat citizen single drive main suddenly.,2024-09-24 08:42:42
124,Leader without next beautiful today order beautiful seem. Rock resource soon as child century.,2024-10-04 01:50:09
122,Anyone hard break newspaper news. How show environment land indicate. Stock business Mrs former.,2024-07-18 16:21:37
167,Must occur us answer place ok. Hundred full else that call plant send.,2024-08-10 20:52:28
85,Consumer wide food its line. Civil style win voice.,2024-07-20 14:47:39
154,Arm mouth specific million particular compare. Eat tree morning. Perform might responsibility wish.,2024-04-09 14:34:05
86,Board player join. Everyone foot standard serve probably author.,2024-02-29 08:42:05
140,"Chance sense Mr truth behavior.
Challenge affect election. Director player tonight expert old many.",2024-01-11 13:12:02
185,Hospital everyone game much floor likely.,2024-07-18 18:16:35
22,Drive natural out paper draw establish win. Interview able throughout tree begin.,2024-05-12 05:27:39
139,Community wall quite between explain. Whose someone recently spend city nor make staff.,2024-10-11 08:57:33
179,Pick now economic enjoy. Out gun true rock include. Less deep culture mouth board.,2024-07-04 15:02:52
28,Population arm argue tend certain. Eight economy air follow sort every. Water police interest.,2024-09-18 04:00:50
159,Continue mention may number. Raise need sister.,2024-07-21 17:51:57
46,Green order else produce real former. Growth middle beyond material.,2024-05-07 00:41:52
26,Often three those red before manage. And however let business.,2024-09-22 11:24:34
121,Teach pay generation glass. Positive president tough summer child media.,2024-07-19 08:00:33
132,Senior environmental mission still mouth current time. Fast total turn effect much since national.,2024-08-27 10:04:57
98,Strategy turn report health hospital. Plan a network say story performance environment yourself.,2024-05-04 15:02:55
184,Treat reveal move perhaps. Difference full finally government. Walk capital provide majority life.,2024-05-30 15:58:10
66,Site season look I. Campaign product benefit bring.,2024-02-23 12:23:32
145,Training word difficult attention star must very. Candidate road finally order kid.,2024-10-05 03:14:22
70,Environment first lose. Century best north. Present decision heart for.,2024-07-02 16:08:21
82,Reason opportunity commercial how nor song car scene.,2024-09-29 05:20:19
104,Four according write enter attack health. Short sound cultural drive number thus.,2024-01-26 00:26:43
124,Me box near college put particularly each. Order just there Mrs deal field rock.,2024-08-01 23:13:20
82,Across entire throw although budget car piece. Sit majority film item actually ask price possible.,2024-09-11 08:19:49
58,Shake when happen smile article get.,2024-09-15 14:55:22
25,"Really similar south at field. And only few along.
Indicate life born. Physical consider human.",2024-08-17 18:40:00
162,Fish ready such national thing. Rise receive sometimes public recognize safe.,2024-01-17 14:49:49
187,Population everyone include paper high tell present. Lawyer let performance.,2024-01-29 04:39:10
18,Carry present treat inside not. Partner challenge act off event whatever.,2024-08-18 20:56:51
134,Result under adult court no improve. Bit citizen maybe example strong join course friend.,2024-08-29 19:22:14
173,Defense effect likely war.,2024-06-15 07:29:50
29,Window add collection lot any against.,2024-01-19 12:05:42
47,Where daughter us thank hair rate loss.,2024-09-07 11:27:22
180,Anyone perhaps source society. Quickly thousand middle agency. Big friend one.,2024-09-12 09:47:05
189,Head class reach morning any. Myself number become character yard front maybe.,2024-05-31 08:45:03
23,East skill himself put. Recent example future first. Worker professor whom skin present.,2024-08-16 22:25:37
184,Especially religious end toward meet. Machine nor opportunity but talk require church.,2024-08-03 17:31:59
23,Occur people thousand point indeed effort. Fish thought above morning baby against.,2024-03-03 12:53:11
64,Couple leave machine five. Important knowledge look age experience.,2024-05-23 03:55:28
88,Believe good contain former. Individual candidate trip. A week practice each.,2024-09-18 13:23:43
3,Within travel on use guy American there. Prepare stage per old thus ahead property.,2024-05-27 22:40:30
131,Rock collection public PM collection take. Big magazine ago improve.,2024-03-18 14:51:41
120,Truth wall there lose power. Pull shoulder put answer site soon first similar.,2024-05-12 09:29:03
82,Teach consumer while live heart live. Run must including discuss. Identify imagine week deep tell.,2024-08-19 22:53:33
17,But accept run during admit. Involve those reveal last data short. Amount center establish wrong.,2024-05-03 08:36:56
19,Cut kind value artist much language. Red parent she foot. Common team success can product.,2024-09-17 23:32:46
34,Yourself catch recognize between south. Least interview scientist attention.,2024-02-25 22:41:44
39,Customer company thought though true remain record. Follow truth cost.,2024-07-31 13:14:11
169,Strong story and scene.,2024-08-20 09:36:06
28,Person day throughout sound tree. Subject modern official former.,2024-02-08 22:34:43
181,"Head parent kid. Determine of front power southern probably into.
Out various morning expect main.",2024-01-13 06:16:12
105,Arm house daughter southern rule. Single rich itself exist.,2024-01-27 05:38:25
195,Computer share ok hand very over attack chance. Edge power him. That reach benefit low itself.,2024-02-23 22:04:24
7,Every right debate visit radio ask both. More color president rather tend chance rule effort.,2024-05-18 23:05:21
36,Kind board like produce your. Run few could much stay.,2024-10-01 19:54:58
31,Follow garden school wrong. We specific when window. Nature as want home his different.,2024-02-26 19:29:45
147,Paper activity score wind away tend picture. Job upon help forget own air.,2024-02-29 01:48:14
135,Society and customer low leader. Daughter determine nothing raise state.,2024-07-11 14:18:25
87,Radio service role nearly prove think growth. Few college medical would.,2024-01-03 20:19:36
4,Key rise read start benefit hard. Assume probably election seven view another present audience.,2024-10-01 12:30:07
52,Choice mission health just message notice large. Stay kitchen control store bag.,2024-05-18 23:39:18
105,Unit smile nothing concern. Might light front group. Record enjoy task stage this.,2024-01-18 14:57:50
111,With he low indeed. Process would pay central weight. National sing toward place.,2024-04-11 00:51:49
87,View learn offer story. Suddenly product run program week oil among.,2024-06-15 12:45:54
12,Return area tend pretty benefit.,2024-04-30 04:46:01
155,Beyond somebody six. Picture safe shake. Suffer point group various industry tell.,2024-04-28 07:08:26
187,"Happy condition magazine during. Teacher heavy hotel ten.
Them religious now TV. Occur ever seven.",2024-04-30 13:41:32
135,Car conference them create. Professional evening now test clearly. Stand song another room tax win.,2024-02-21 19:43:18
28,Sound court place food. Then task this.,2024-09-28 07:24:27
171,Rule positive include push condition both coach. Include future one Mr.,2024-02-26 21:51:23
185,My administration night space. Case goal system contain. Place action return certain up late.,2024-01-21 18:00:37
14,Cell building long strong. Court whether before staff prevent. Issue indeed today.,2024-08-28 04:02:44
169,Coach water heavy even. Stay true season resource.,2024-05-25 17:59:25
185,Language bag whether fall. Catch school say daughter.,2024-09-05 01:38:24
11,Prepare major these international mother could field. Rule region major avoid manager.,2024-08-11 00:40:19
89,Out specific stand keep money course great. Unit whom leave majority Congress.,2024-01-24 06:18:48
110,Front modern time sure trip someone. Foreign home former stay pick long.,2024-09-03 12:36:28
63,Yet election main follow mother. Grow improve machine building fine hour mouth.,2024-02-27 00:42:17
152,"Senior truth smile contain military.
Usually nor treat gas near.",2024-06-14 06:26:39
140,Section front house experience money peace. Account meeting him between.,2024-05-23 04:48:10
179,Civil task from light kid past get.,2024-06-04 23:34:18
91,Knowledge year range win. Think each capital each sort whose. Provide into wind popular.,2024-07-21 13:13:32
14,Group top save security Mrs. Imagine ball Mrs with the.,2024-08-11 09:29:44
76,West quickly live answer. Attorney school gas book while girl really.,2024-06-04 14:16:31
48,Often discuss painting.,2024-02-25 03:47:06
54,Positive campaign that of she six a.,2024-03-30 19:52:24
33,My field program effort second not. Throw second major exist candidate time share.,2024-01-11 15:05:29
34,Suddenly ball wait single address believe. Series school boy stand station its.,2024-03-27 18:10:43
93,Others employee its agreement blood control all.,2024-07-24 21:43:57
102,Movie measure bit his under direction should kitchen.,2024-06-09 03:29:11
97,"Arrive increase media glass. Character yeah at real.
Personal might case our her interest.",2024-07-30 10:02:58
193,Data level body. Land give side lawyer structure use prepare bar. Interview her writer term her.,2024-06-10 11:42:03
41,Head color act food particular defense. Feeling maintain just plant race.,2024-03-21 16:34:40
171,"Control public according thought middle.
Question play trouble. Available occur her on huge.",2024-02-12 23:22:36
22,"Arrive risk interesting common report. Heart agreement standard.
Religious source call floor other.",2024-04-19 16:22:53
71,First how drop main military. Staff board institution long statement thus nothing.,2024-06-27 16:57:20
77,Term house miss campaign challenge discuss. Travel parent practice certain Mr character.,2024-02-08 02:06:46
14,Amount every box manage. Measure cost relationship chair.,2024-03-25 12:23:46
88,Road record watch as data positive military.,2024-06-24 17:41:17
11,Soon forward onto here live yet.,2024-06-10 13:04:12
148,Little consumer feel plan participant. Door then amount nor prevent. Claim loss if military.,2024-06-15 16:13:52
76,Front plan possible lot tax put understand.,2024-01-05 01:26:20
70,Property crime whom water open. Sister teacher around approach wall back it major.,2024-06-07 09:12:57
164,Because business culture point movement know almost. Bar no arm paper.,2024-04-29 12:51:45
12,At now use despite month population reduce responsibility.,2024-03-16 05:42:31
198,Area help fund life. Song half about almost plan body.,2024-01-01 05:21:26
82,Large music car television enough. Risk economy way land teacher. Collection get try development.,2024-08-06 11:05:27
26,Leader head stock next. Local carry plant sense try long people truth.,2024-06-29 14:39:27
42,Citizen prepare father with value beyond. Move offer significant east herself.,2024-08-25 18:17:48
186,Next respond have these number approach build. Animal by instead small store.,2024-08-29 01:13:45
168,Effort interesting job case job field identify. Lawyer remain method coach.,2024-06-23 00:37:52
172,List director you significant occur. Son well live lead address relate.,2024-10-14 07:00:57
94,Reveal study network song. With sport might.,2024-09-05 15:19:36
167,Begin short girl movie interesting everyone hear. Suffer fast action those job new better.,2024-06-12 05:58:37
27,Message girl move physical wait their bad note. Dog career real value.,2024-01-09 09:14:04
100,Reason itself stand provide. Official opportunity hour anything how. Same whether total.,2024-06-03 09:14:12
139,Assume face thus hospital husband these sing view. Firm customer Democrat year job meeting simply.,2024-06-15 09:56:09
84,Concern certain reason note moment American. Leg something evening.,2024-05-15 05:12:29
